{
  "bundle_id": "TEMPLATE-REPLACE-ME",
  "status": "template",
  "claim_class": "none",
  "created_utc": "YYYY-MM-DDTHH:MM:SSZ",
  "operators": [],
  "modules": [
    {
      "module_id": "MODULE-ID",
      "body_role": "echosahedron",
      "body_hash": "sha256:REPLACE-ME",
      "mesh_path": "body/mesh.stl",
      "photo_hashes": []
    }
  ],
  "controller": {
    "controller_id": "CONTROLLER-ID",
    "firmware_hash": "sha256:REPLACE-ME",
    "wiring_map_hash": "sha256:REPLACE-ME"
  },
  "task": {
    "task_id": "TASK-ID",
    "benchmark": "BENCHMARK-NAME",
    "scorebook_hash": "sha256:REPLACE-ME"
  },
  "verifier": {
    "verifier_id": "VERIFIER-ID",
    "verifier_hash": "sha256:REPLACE-ME",
    "receipt_path": "task/verifier_receipts.jsonl"
  },
  "artifacts": {
    "dark_scan": "calibration/dark_scan.csv",
    "low_power_sweep": "calibration/low_power_sweep.csv",
    "coupling_matrix": "calibration/coupling_matrix.csv",
    "mdd_trace": "calibration/mdd_trace.csv",
    "ring_diversity": "calibration/ring_diversity.csv"
  },
  "controls": [
    "negative_controls.md"
  ],
  "non_claims": [
    "Does not prove OPH.",
    "Does not prove a complexity-class collapse.",
    "Does not promote source-only hadron rows."
  ]
}
